{
  "$ref": "#/definitions/teams",
  "definitions": {
    "teams": {
      "type": "object",
      "properties": {
        "title": {
          "type": "string"
        },
        "displayName": {
          "type": "string"
        },
        "instagramUrl": {
          "type": "string",
          "format": "uri"
        },
        "facebookUrl": {
          "type": "string",
          "format": "uri"
        },
        "teamPhoto": {
          "type": "string"
        },
        "staff": {
          "type": "array",
          "items": {
            "type": "object",
            "properties": {
              "name": {
                "type": "string"
              },
              "email": {
                "type": "string",
                "format": "email"
              },
              "bio": {
                "type": "array",
                "items": {
                  "type": "string"
                }
              }
            },
            "required": [
              "name",
              "bio"
            ],
            "additionalProperties": false
          }
        },
        "roster": {
          "type": "array",
          "items": {
            "type": "object",
            "properties": {
              "name": {
                "type": "string"
              },
              "number": {
                "type": "number"
              },
              "position": {
                "type": "string"
              },
              "gradYear": {
                "type": "number"
              },
              "highSchool": {
                "type": "string"
              }
            },
            "required": [
              "name",
              "number",
              "position",
              "gradYear",
              "highSchool"
            ],
            "additionalProperties": false
          }
        },
        "schedule": {
          "type": "array",
          "items": {
            "type": "object",
            "properties": {
              "dates": {
                "type": "string"
              },
              "tournament": {
                "type": "string"
              },
              "location": {
                "type": "string"
              }
            },
            "required": [
              "dates",
              "tournament",
              "location"
            ],
            "additionalProperties": false
          }
        },
        "$schema": {
          "type": "string"
        }
      },
      "required": [
        "title",
        "staff"
      ],
      "additionalProperties": false
    }
  },
  "$schema": "http://json-schema.org/draft-07/schema#"
}