{
  "title": "14U EVANS",
  "displayName": "14U Evans Team",
  "staff": [
    {
      "name": "Andy Evans - Head Coach",
      "email": "andyevans@firecrackersohio.com",
      "bio": [
        "Andy brings over 17 years of coaching experience to the Firecrackers OH program, including four years at the travel level with respected organizations such as Bo Jackson Blast and Ohio Hit Dogs.",
        "His coaching résumé also includes middle school softball at St. Paul the Apostle (Westerville) and eight years of high school football at St. Francis DeSales, where he has helped shape well-rounded, disciplined athletes focused on effort, commitment to the team, and resiliency.",
        "As a travel softball coach, Andy’s teams have found tremendous success, placing first in the Marengo Tango, Liberty-Benton Eagles Classic, and Moonshot Madness tournaments, with 2 additional 3rd place finishes in the Mid-Ohio Buckeye Cup and School’s Out Shootout Tournaments.",
        "Coach Evans is known for his ability to foster athletic versatility and confidence, with a coaching style built on trust, growth, and grit."
      ]
    },
    {
      "name": "Eric Lauterbach - Assistant Coach",
      "bio": [
        "Eric has been coaching alongside Andy for the past three seasons, including tenures with Bo Jackson Blast and Ohio Hit Dogs.  In addition to his role as assistant coach for the Firecrackers OH 14U team, He currently serves as the head 8th grade softball coach at Dublin Grizzell Middle School and has several years’ experience coaching travel baseball.  His calm demeanor and ability to connect with young athletes make him a vital part of the staff."
      ]
    },
    {
      "name": "Brent Purdom - Assistant Coach",
      "bio": [
        "Brent joined the staff in 2024, focused on mental and physical skill development and fundamentals, having coached softball for many years prior to joining Andy’s staff.  He brings a team-first mentality and an emphasis on effort, fundamentals, and steady improvement."
      ]
    }
  ],
  "schedule": [
    {
      "dates": "5/29 - 5/31",
      "tournament": "Capital City Showdown",
      "location": "Berliner Park, Columbus"
    },
    {
      "dates": "6/5 - 6/7",
      "tournament": "Hits 4 Hope Tourney",
      "location": "Grove City, OH"
    },
    {
      "dates": "6/12 - 6/14",
      "tournament": "USSSA Tenn. ST. Champ.",
      "location": "Hendersonville, TN"
    },
    {
      "dates": "6/19 - 6/21",
      "tournament": "Firecrackers Boom Bash",
      "location": "Marysville, OH"
    },
    {
      "dates": "6/26 - 6/28",
      "tournament": "Rails and RBI’s",
      "location": "Wellston, OH"
    },
    {
      "dates": "7/10 - 7/12",
      "tournament": "Marengo Tango",
      "location": "Marengo, OH"
    },
    {
      "dates": "7/17 - 7/19",
      "tournament": "Dawg Daze Showdown",
      "location": "Findlay, OH"
    },
    {
      "dates": "7/24 - 7/26",
      "tournament": "World Series",
      "location": "Berliner Park, Columbus"
    }
  ]
}
